{
  "schemaVersion": 1,
  "id": "yu-gi-oh-duel-links",
  "status": "active",
  "name": "Yu Gi Oh: Duel Links",
  "stores": [
    {
      "store": "steam",
      "primary": true,
      "url": "https://store.steampowered.com/app/601510/YuGiOh_Duel_Links/"
    }
  ],
  "accessibility": {
    "description": "Accessibility support is in active development.",
    "accessVia": "mod",
    "tags": [
      "blind"
    ],
    "wikiRatingUrl": "https://accessiblegaming.wiki/AccessibilityRating/YuGiOh:DuelLinks/Blind",
    "primaryModId": "duel-links-access"
  },
  "resources": [
    {
      "name": "AudioGames.net forum thread",
      "url": "https://forum.audiogames.net/topic/59726/"
    }
  ],
  "media": [
    {
      "name": "Duel Links, Cult of the Lamb, Paralives and Disgaea 5: mixed mod showcase audio",
      "url": "https://audiopub.site/listen/4d537550-70df-40ee-9753-39174fc9f496",
      "creatorId": "zersiax",
      "creatorProfileUrl": "https://audiopub.site/user/@zersiax",
      "mediaType": "audio",
      "note": "Mixed mod showcase; no game-specific segment timestamp established."
    }
  ],
  "releaseYear": "2017"
}
