{
  "schemaVersion": 1,
  "id": "slay-the-princess",
  "status": "active",
  "name": "Slay the Princess",
  "stores": [
    {
      "store": "steam",
      "primary": true,
      "url": "https://store.steampowered.com/app/1989270/Slay_the_Princess/"
    },
    {
      "store": "gog",
      "url": "https://www.gog.com/en/game/slay_the_princess"
    },
    {
      "store": "humble",
      "url": "https://www.humblebundle.com/store/slay-the-princess"
    }
  ],
  "accessibility": {
    "description": "Fully accessible.",
    "coverage": "full",
    "confidence": "verified",
    "accessVia": "native",
    "tags": [
      "blind"
    ],
    "wikiRatingUrl": "https://accessiblegaming.wiki/AccessibilityRating/SlayThePrincess/Blind"
  },
  "resources": [
    {
      "name": "AudioGames.net forum thread",
      "url": "https://forum.audiogames.net/topic/49944/"
    }
  ],
  "media": [
    {
      "name": "Blind Gamer Plays Slay the Princess for the First Time! Did Not Disappoint!",
      "url": "https://www.youtube.com/watch?v=-bJ-C0pNoTo",
      "creatorId": "ross-minor",
      "creatorProfileUrl": "https://www.youtube.com/channel/UCoZujToINVP7xax9BTc7s2g",
      "mediaType": "video"
    },
    {
      "name": "Slay the Princess accessibility spotlight",
      "url": "https://www.youtube.com/watch?v=QaK4_8d5sy0",
      "creatorId": "illegallysighted",
      "creatorProfileUrl": "https://www.youtube.com/channel/UC0ZrgEzJQeZgEo5A2ERu0NA",
      "mediaType": "video"
    }
  ],
  "releaseYear": "2023"
}
