{
  "schemaVersion": 1,
  "id": "roller-coaster-tycoon-2",
  "status": "active",
  "name": "Roller Coaster Tycoon 2",
  "stores": [
    {
      "store": "steam",
      "primary": true,
      "url": "https://store.steampowered.com/app/285330/"
    },
    {
      "store": "gog",
      "url": "https://www.gog.com/en/game/rollercoaster_tycoon_2"
    },
    {
      "store": "humble",
      "url": "https://www.humblebundle.com/store/rollercoaster-tycoon-2-triple-thrill-pack"
    }
  ],
  "accessibility": {
    "description": "Accessibility support is in active development.",
    "accessVia": "mod",
    "tags": [
      "blind"
    ],
    "wikiRatingUrl": "https://accessiblegaming.wiki/AccessibilityRating/RollercoasterTycoon2/Blind",
    "primaryModId": "openrct2-access"
  },
  "resources": [
    {
      "name": "AudioGames.net forum thread",
      "url": "https://forum.audiogames.net/topic/59674/"
    }
  ],
  "media": [
    {
      "name": "RollerCoaster Tycoon 2 - OpenRCT2 Access demonstration",
      "url": "https://www.youtube.com/watch?v=0opYxGETLa0",
      "creatorId": "ross-minor",
      "creatorProfileUrl": "https://www.youtube.com/channel/UC3yVjuZy4VzYhoYtPVtTz9Q",
      "mediaType": "video"
    }
  ],
  "releaseYear": "2002"
}
