{
  "schemaVersion": 1,
  "id": "assassins-creed-shadows",
  "status": "active",
  "name": "Assassin's Creed Shadows",
  "stores": [
    {
      "store": "steam",
      "primary": true,
      "url": "https://store.steampowered.com/app/3159330/Assassins_Creed_Shadows/"
    },
    {
      "store": "xbox",
      "url": "https://www.xbox.com/en-US/games/store/assassins-creed-shadows/9P42LWGMC7K4"
    }
  ],
  "accessibility": {
    "description": "Has many accessibility features, but not fully accessible for blind gamers.",
    "tags": [
      "audio-description"
    ]
  },
  "media": [
    {
      "name": "Assassin's Creed Shadows: accessibility showcase",
      "url": "https://www.youtube.com/watch?v=zHaMsD3eWqE",
      "creatorId": "zersiax",
      "creatorProfileUrl": "https://www.youtube.com/channel/UC7uLYSknPG3pATnbhYyXE5g",
      "mediaType": "video"
    },
    {
      "name": "Ubisoft ALMOST Nailed It! Assassin’s Creed: Shadows Accessibility Review",
      "url": "https://www.youtube.com/watch?v=EuGcyjsWY3c",
      "creatorId": "steve-saylor",
      "creatorProfileUrl": "https://www.youtube.com/channel/UCtWREyqj2spI0KiWHp09Fvg",
      "mediaType": "video"
    }
  ],
  "releaseYear": "2025"
}
