{
  "schemaVersion": 1,
  "id": "mortal-kombat-1",
  "status": "active",
  "name": "Mortal Kombat 1",
  "stores": [
    {
      "store": "steam",
      "primary": true,
      "url": "https://store.steampowered.com/app/1971870/Mortal_Kombat_1/"
    },
    {
      "store": "humble",
      "url": "https://www.humblebundle.com/store/mortal-kombat-1"
    },
    {
      "store": "psn",
      "url": "https://store.playstation.com/en-us/product/UP1018-PPSA07570_00-MKONE00000000000"
    },
    {
      "store": "switch",
      "url": "https://www.nintendo.com/us/store/products/mortal-kombat-1-switch/"
    }
  ],
  "accessibility": {
    "description": "Fully accessible with audio description.",
    "accessVia": "native",
    "tags": [
      "audio-description",
      "blind"
    ],
    "wikiRatingUrl": "https://accessiblegaming.wiki/AccessibilityRating/MortalKombat1/Blind"
  },
  "resources": [
    {
      "name": "AudioGames.net forum thread",
      "url": "https://forum.audiogames.net/topic/49655/"
    }
  ],
  "media": [
    {
      "name": "MORTAL KOMBAT 1 is the BEST Fighting game for BLIND GAMERS! - Accessibility Review (Xbox Series X)",
      "url": "https://www.youtube.com/watch?v=zrNnySYHruw",
      "creatorId": "steve-saylor",
      "creatorProfileUrl": "https://www.youtube.com/channel/UCtWREyqj2spI0KiWHp09Fvg",
      "mediaType": "video"
    },
    {
      "name": "Mortal Kombat 1 accessibility spotlight",
      "url": "https://www.youtube.com/watch?v=5eOsRwo8pNo",
      "creatorId": "illegallysighted",
      "creatorProfileUrl": "https://www.youtube.com/channel/UC0ZrgEzJQeZgEo5A2ERu0NA",
      "mediaType": "video"
    },
    {
      "name": "Welcome to the New Era of Mortal Kombat 1 \\ Blind Accessibility Review",
      "url": "https://www.youtube.com/watch?v=2OMD7qYxVq4",
      "creatorId": "ross-minor",
      "creatorProfileUrl": "https://www.youtube.com/channel/UCoZujToINVP7xax9BTc7s2g",
      "mediaType": "video"
    }
  ],
  "releaseYear": "2023"
}
